{
  "schema_version": "zentinel.pipeline.verification.v1",
  "task_id": "064",
  "status": "passed",
  "stages": [
    {
      "name": "task_system_validation",
      "required": true,
      "status": "passed",
      "command": "python3 scripts/validate_task_system.py"
    }
  ],
  "residual_risk": [],
  "recommendation": "complete"
}
