{
  "schema_version": "zentinel.pipeline.verification.v1",
  "task_id": "053",
  "status": "passed",
  "working_tree_state": "clean",
  "stages": [
    {
      "name": "task_system_validation",
      "required": true,
      "status": "passed",
      "command": "python3 scripts/validate_task_system.py",
      "artifact": "artifacts/pipeline/053/verification/report.json"
    },
    {
      "name": "targeted_unit_tests",
      "required": true,
      "status": "passed",
      "command": "zig build test",
      "evidence": "ai_context_test (schema-valid context + snapshot, missing nested fields rejected, structured commands array, legacy-payload rejection, argv0/env/shell rules, skip_reason rules, 4096 UTF-8 excerpt cap, preview backend vs operator stability, redaction fail-closed, config redact default + remote rejection, deterministic stub provider) passes; full suite green"
    },
    {
      "name": "property_tests",
      "required": true,
      "status": "passed",
      "evidence": "the stub provider is deterministic (same context yields the same advisory); redaction is deterministic and fails closed on unsupported patterns; the excerpt cap never splits a UTF-8 codepoint"
    },
    {
      "name": "ai_advisory_only_boundary",
      "required": true,
      "status": "passed",
      "evidence": "AI is advisory-only: providers return text under advisory fields and never a mutant status or any deterministic result field; the context validator rejects legacy single-command result payloads and over-long excerpts; closed invariant I-004 and failure mode F-020"
    },
    {
      "name": "build",
      "required": true,
      "status": "passed",
      "command": "zig build"
    },
    {
      "name": "mutation_checks",
      "required": false,
      "status": "not_applicable",
      "reason": "AI plumbing is advisory-only and deterministic; full self-mutation dogfood is gated to the Phase 5 stages (task 085)"
    }
  ],
  "residual_risk": [
    "remote provider calls are out of scope here; provider.run returns a deterministic stand-in for remote and the live remote path plus the CLI ZNTL_AI_PROVIDER_NOT_ALLOWED override are owned by task 054"
  ],
  "recommendation": "complete"
}
