{
  "schema_version": "zentinel.pipeline.verification.v1",
  "task_id": "052",
  "status": "passed",
  "working_tree_state": "clean",
  "stages": [
    {
      "name": "task_system_validation",
      "required": true,
      "status": "passed",
      "command": "python3 scripts/validate_task_system.py",
      "artifact": "artifacts/pipeline/052/verification/report.json"
    },
    {
      "name": "targeted_unit_tests",
      "required": true,
      "status": "passed",
      "command": "zig build test",
      "evidence": "performance_benchmark_test (cached/uncached, cold/warm, serial/parallel equivalence; machine-readable benchmark snapshot; diagnostics.cache snapshot + schema validity) passes; full suite green"
    },
    {
      "name": "property_tests",
      "required": true,
      "status": "passed",
      "evidence": "equivalentIgnoringTiming proves cached and uncached reports differ only in diagnostics.cache and durations, cold and warm runs are identical except durations, and serial and parallel reports differ only in durations; worker_pool paths give every concurrent mutant a distinct workspace, .zig-cache, and zig-out"
    },
    {
      "name": "documentation_budget_check",
      "required": true,
      "status": "passed",
      "command": "python3 scripts/check_perf_budgets.py",
      "evidence": "failed on the pre-052 doc (git show HEAD), passes with the four concrete numeric CI smoke budgets added to docs/PERFORMANCE_STRATEGY.md"
    },
    {
      "name": "build",
      "required": true,
      "status": "passed",
      "command": "zig build"
    },
    {
      "name": "mutation_checks",
      "required": false,
      "status": "not_applicable",
      "reason": "full self-mutation dogfood of the cache/worker/report code is gated to the Phase 5 stages (task 085); the benchmark and equivalence contracts are deterministic and covered by unit and property-style tests"
    }
  ],
  "residual_risk": [
    "the report v1 diagnostics.cache field is populated through cache.toReportDiagnostics; the run command's product report is not changed here (run_command.zig is outside this task's allowed scope), so wiring it into the live run is a follow-up consumer step"
  ],
  "recommendation": "complete"
}
