{
  "schema_version": "zentinel.pipeline.verification.v1",
  "task_id": "046",
  "status": "passed",
  "stages": [
    {
      "name": "task_system_validation",
      "required": true,
      "status": "passed",
      "command": "python3 scripts/validate_task_system.py"
    },
    {
      "name": "doctests",
      "required": false,
      "status": "not_applicable",
      "reason": "task changes no public executable example"
    },
    {
      "name": "performance_checks",
      "required": false,
      "status": "not_applicable",
      "reason": "task is not performance-sensitive"
    }
  ],
  "residual_risk": [],
  "recommendation": "complete"
}
