{
  "schema_version": "zentinel.pipeline.verification.v1",
  "task_id": "042",
  "status": "passed",
  "stages": [
    {
      "name": "context_packet_fixture_validation",
      "required": true,
      "status": "passed",
      "command": "python3 - (subset_validate over test/fixtures/pipeline/context_packet/{valid,invalid}/*.json)",
      "artifact": "test/fixtures/pipeline/context_packet"
    },
    {
      "name": "non_breaking_schema_refinement",
      "required": true,
      "status": "passed",
      "command": "python3 - (subset_validate of the 041 context/stale_context fixtures and the 063 metadata_validator context packet against the refined schemas)"
    },
    {
      "name": "key_order_permutation_property",
      "required": true,
      "status": "passed",
      "command": "python3 - (permute context packet keys; semantic content, not key order, controls validity)"
    },
    {
      "name": "task_system_validation",
      "required": true,
      "status": "passed",
      "command": "python3 scripts/validate_task_system.py"
    },
    {
      "name": "mutation_checks",
      "required": false,
      "status": "not_applicable",
      "reason": "docs, schemas, and JSON fixtures only; no context packet validation code added to deterministic core"
    }
  ],
  "residual_risk": [],
  "recommendation": "complete"
}
