{
  "schema_version": "zentinel.pipeline.verification.v1",
  "task_id": "046",
  "status": "passed",
  "working_tree_state": "clean",
  "stages": [
    {
      "name": "task_system_validation",
      "required": true,
      "status": "passed",
      "command": "python3 scripts/validate_task_system.py",
      "artifact": "artifacts/pipeline/046/verification/report.json"
    },
    {
      "name": "verification_fixture_validation",
      "required": true,
      "status": "passed",
      "command": "python3 - (verification checker over test/fixtures/pipeline/verification/{valid,invalid}/*.json and the 041 flat pair)",
      "artifact": "test/fixtures/pipeline/verification"
    },
    {
      "name": "schema_non_breaking_refinement",
      "required": true,
      "status": "passed",
      "evidence": "041 valid.json still validates and invalid.json is still rejected against the refined pipeline.verification.v1 schema"
    },
    {
      "name": "mutation_checks",
      "required": false,
      "status": "not_applicable",
      "reason": "docs, schema, and JSON fixtures only; no executable behavior changed"
    },
    {
      "name": "doctests",
      "required": false,
      "status": "not_applicable",
      "reason": "no public executable example block added or changed"
    }
  ],
  "residual_risk": [],
  "recommendation": "complete"
}
