{
  "schema_version": "zentinel.pipeline.verification.v1",
  "task_id": "051",
  "status": "passed",
  "working_tree_state": "clean",
  "stages": [
    {
      "name": "task_system_validation",
      "required": true,
      "status": "passed",
      "command": "python3 scripts/validate_task_system.py",
      "artifact": "artifacts/pipeline/051/verification/report.json"
    },
    {
      "name": "targeted_unit_tests",
      "required": true,
      "status": "passed",
      "command": "zig build test",
      "evidence": "fail_fast_impact_test (baseline fail-fast truncation, deterministic impact_graph selection, conservative fallback, documented mutant skip reasons, end-to-end impact_graph report) and config_test (impact_graph accepted; unknown strategy still rejected) pass; full suite green"
    },
    {
      "name": "property_tests",
      "required": true,
      "status": "passed",
      "evidence": "impact analysis selects same-file tests in deterministic (file, line, name) order; impact_graph narrows when the impact set is covered and conservatively falls back to the full suite when uncertain"
    },
    {
      "name": "build",
      "required": true,
      "status": "passed",
      "command": "zig build"
    },
    {
      "name": "mutation_checks",
      "required": false,
      "status": "not_applicable",
      "reason": "full self-mutation dogfood of zentinel's own runner/selection is gated to the Phase 5 stages (task 085); fail-fast and impact analysis are deterministic and covered by unit and property-style tests"
    },
    {
      "name": "final_artifact_audit",
      "required": true,
      "status": "passed",
      "evidence": "task-control Markdown and JSON agree; fail-fast never hides survivors (baseline failure yields zero mutants and exit 3; mutant fail-fast records documented skip reasons); completion evidence lists concrete changed files"
    }
  ],
  "residual_risk": [],
  "recommendation": "complete"
}
