{
  "schema_version": "zentinel.pipeline.verification.v1",
  "task_id": "046",
  "status": "blocked",
  "stages": [
    {
      "name": "task_system_validation",
      "required": true,
      "status": "passed",
      "command": "python3 scripts/validate_task_system.py"
    },
    {
      "name": "mutation_checks",
      "required": true,
      "status": "blocked",
      "evidence": "untriaged survivor m_8kjyy9kdjw9zngpb31q659cqmt",
      "reason": "survivor awaiting triage"
    }
  ],
  "residual_risk": [
    "one untriaged survivor"
  ],
  "recommendation": "block"
}
